{
  "schema": "ontogony-six-repo-lock-v1",
  "baseline": "SYSTEM-RC-002",
  "generatedAt": "2026-05-29T20:14:50.508Z",
  "postLockDeltaRegister": "docs/system/ontogony-six-repo-post-lock-deltas.json",
  "repos": {
    "ontogony-platform": {
      "commit": "f05decf7ec0233ad861099aa8d5d416653eac0ba",
      "packageVersion": "0.3.0-alpha.1"
    },
    "conexus-dotnet": {
      "commit": "5b2c01760a23c8aac2fd5a5407f94ca9db28013e",
      "clientVersion": "0.1.0-alpha.1"
    },
    "kanon-dotnet": {
      "commit": "852a6e6ea625adafd9b0bc3de8591b8f267aa0fc",
      "clientVersion": "0.1.0-alpha.0"
    },
    "allagma-dotnet": {
      "commit": "0fa047294755fd5eb46ed914567722592a2b026a",
      "apiPrefix": "/allagma/v0"
    },
    "ontogony-ui": {
      "commit": "25a0a8e66271aa2382f4c91c3b4ad19b90a3edc7",
      "packageVersion": "0.1.0-alpha.0",
      "tarballSha256": "ad206ccd82d7f0b703ea7d4b3bf18c0b03dca1b955ae23643e49664ff08e55e0"
    },
    "ontogony-frontend": {
      "commit": "aab142ab860ec9be1b20a9411a6d92365246779c",
      "buildProvenanceSha256": "9ddb3b48e0ade1e16f4d3040180e30b525d9536cf6d64297c90e6e97a2fb0470"
    }
  },
  "contracts": {
    "openapiSnapshots": {
      "allagma": "effbb9b4a353d77e9f693a7d7f314eeb753d578941da4612c110aac4f62f2a7e",
      "conexus": "eb512afc37c1820f0556b8415c05ad84fdb901eb5717976d0c928508c09423da",
      "kanon": "b3ae227d79d92263cbbb2cd6729325c5219b8b02dfed81986a2583b856a7ac85"
    },
    "routeInventories": {},
    "frontendRouteInventory": "4e9be53b6c504c989de38d5f1715cce45f162821a285e196088b0e497a3c44ca",
    "uiPublicSubpaths": "171b26a50e552f6f9146129b9a6485182c2eaf732bf76bd778ef261368c37ec9"
  }
}
